{
  "schemaVersion": "judge_receipt/1",
  "judgeId": "f47ac10b-58cc-4372-a567-0e02b2c3d479",
  "adapter": "host_subagent",
  "modelClass": "kimi-code-cli",
  "targetSha256": "6cae5336055b94e23bd2eca9b962b32d9fc40cb05e515f065a652323d74b826f",
  "candidateSha256": "6cae5336055b94e23bd2eca9b962b32d9fc40cb05e515f065a652323d74b826f",
  "scores": {
    "composition": 3.0,
    "lighting": 3.0,
    "materials": 3.0,
    "details": 1.0,
    "total": 10.0
  },
  "gaps": [],
  "recommendation": "accept",
  "freshContext": true,
  "sawPromptDraft": false,
  "judgedAt": "2026-09-22T00:00:00Z"
}