{
  "schemaVersion": "judge_receipt/1",
  "judgeId": "bc3c2a79-a6be-42b6-85cd-d272a5e1c8ac",
  "adapter": "host_subagent",
  "modelClass": "kimi",
  "targetSha256": "6cae5336055b94e23bd2eca9b962b32d9fc40cb05e515f065a652323d74b826f",
  "candidateSha256": "d7ccd2086845a7b6fd8972f70d10caa6cf6cbee872f7d3fe409ed4bfacc0aaa1",
  "scores": {
    "composition": 3.0,
    "lighting": 0.5,
    "materials": 1.5,
    "details": 1.0,
    "total": 6.0
  },
  "gaps": [
    {
      "dimension": "lighting",
      "severity": "high",
      "location": "entire frame (all 16x12 pixels)",
      "observation": "Candidate is a uniform light-gray fill #C0C0C0 (~75% luminance) while target is a uniform dark-gray fill #404040 (~25% luminance) — a ~3x global exposure/value shift; candidate reads as heavily overexposed relative to the target. Neutral color temperature matches (both pure gray).",
      "fixHint": "Set the uniform fill value to RGB(64,64,64) instead of RGB(192,192,192)."
    },
    {
      "dimension": "materials",
      "severity": "medium",
      "location": "entire frame (surface albedo)",
      "observation": "Neither image has texture or translucency, but the flat surface reads as light gray in the candidate versus dark gray in the target, so perceived surface albedo is wrong even though surface finish (matte, featureless) matches.",
      "fixHint": "Same single-value correction: darken the solid fill to #404040 so the surface tone matches the target."
    }
  ],
  "recommendation": "revise",
  "freshContext": true,
  "sawPromptDraft": false,
  "judgedAt": "2026-09-21T17:51:59Z"
}