{
  "schemaVersion": "judge_receipt/1",
  "judgeId": "7c9e6679-7425-40de-944b-e07fc1f90ae7",
  "adapter": "host_subagent",
  "modelClass": "GLM-5.3-Flash (ZCode)",
  "freshContext": true,
  "sawPromptDraft": false,
  "judgedAt": "2026-09-22T01:58:00Z",
  "targetSha256": "6cae5336055b94e23bd2eca9b962b32d9fc40cb05e515f065a652323d74b826f",
  "candidateSha256": "6cae5336055b94e23bd2eca9b962b32d9fc40cb05e515f065a652323d74b826f",
  "scores": {
    "composition": 3.0,
    "lighting": 3.0,
    "materials": 3.0,
    "details": 1.0,
    "total": 10.0
  },
  "gaps": [],
  "recommendation": "accept"
}