{
  "schemaVersion": "judge_receipt/1",
  "judgeId": "b7f1c2a4-9d3e-4f8a-8c21-5e0a6d4b7f93",
  "adapter": "host_subagent",
  "modelClass": "deepseek-v4-flash",
  "targetSha256": "6cae5336055b94e23bd2eca9b962b32d9fc40cb05e515f065a652323d74b826f",
  "candidateSha256": "6cae5336055b94e23bd2eca9b962b32d9fc40cb05e515f065a652323d74b826f",
  "scores": {
    "composition": 3.0,
    "lighting": 3.0,
    "materials": 3.0,
    "details": 1.0,
    "total": 10.0
  },
  "gaps": [],
  "recommendation": "accept",
  "freshContext": true,
  "sawPromptDraft": false,
  "judgedAt": "2026-09-22T00:00:00Z"
}